“I had to restructure the food that I put in my mouth. I had to think about what I was eating and how I was eating and how it was going to be good for my body,” she said. “I became excited about food again, and food became a joy.” 
It isn’t always easy, of course. Ray admits to an occasional cookie craving. But now she takes the time to think about how her body processes that cookie and whether it’s worthwhile. 
She hopes her cooking can help other people make the same transformation she did. Her staff at North Sarah helps her create new recipes for others. She wants to provide nourishment that allows people to avoid illness and medicine. 
“Nobody wants to take 55 pills, nobody wants to feel like a patient, but how do you fix that? It’s by our food,” she said. “That should be what we’re teaching our community and our culture and our children. … It’s not always about the macaroni noodle with a smile, it’s about what’s good for your body.” 
Castrucci is a third-generation diabetes patient. The lifetime risk of developing Type 2 diabetes if a parent has it is 40%. If both parents have it, the risk jumps to 70%.
He knew he was at risk, but he pushed his luck, he said, by eating poorly during the pandemic and falling out of his exercise routine. With the luxury of working from home, walking to the kitchen and bathroom was often the extent of his daily activity.
On Feb. 14, 2022 – Valentine’s Day – he went to an urgent care clinic, concerned his breathing trouble meant he had bronchitis. His blood pressure measured 210 over 110, well above normal levels that top out at 120 over 80. A chest X-ray showed fluid filling his lungs, leading to congestive heart failure. 
The clinic sent him straight to a local emergency room, where he was diagnosed with a blockage of the left descending artery – a clogged artery made worse by diabetes. If he had waited any longer, he would have had a massive heart attack, his doctor later told him.
After his release from the hospital, he went to the drugstore to fill his new prescriptions. The pharmacist told him she couldn’t fill one because it would cost $1,000. He’d have to wait until his insurance approved it. “Please fill it,” he said. She stressed the cost. “Fill it,” he pleaded, putting the charge on his credit card.
Medication helped him lose 70 pounds in three months. When his local drugstore ran out of the weight-loss drug, he easily drove to another pharmacy and then another to find what he needed. 
His 100 hours of high-quality cardiac rehabilitation were fully covered by insurance.  
"For my midlife crisis, I got healthy," Castrucci said.
He could devote all his energy to getting well because he didn’t have to focus on how to afford his care. “(I) paid almost nothing for the whole episode,” he said, “and never worried about it because I have really good insurance.” 
Even so, Castrucci pays out-of-pocket for a cardiologist and an endocrinologist because the best ones near him don’t accept insurance.
Every time he goes to Walgreens to refill his medications, Castrucci said, he sees someone turned away because they can’t afford their prescriptions. When they finally show up in the emergency room, “because they will,” they will cost the system far more, he said.
“Health outcomes are dictated by economics. It’s a whole side of privilege that we don’t always talk about.”
On the day Haynes stepped on a rusty nail in 2019, he walked all day as the nail pierced the sole of his sneaker and then his foot. By the time he took off his shoe that night, his foot was infected. He landed in the hospital for two months as doctors and nurses tried, mostly unsuccessfully, to get the infection and Haynes’ blood sugar under control.
By the time he was released, he knew enough about Type 2 diabetes to realize his daily blood sugar levels – typically in the mid-400s – were four times above what he had been told to shoot for.
But nothing he did or ate seemed to make a difference. He had long since traded ribs for salads, beer for water. 
His wife, Angela, barely noticed when James started wearing multiple pairs of socks, pouring powder on his feet and buying bigger shoes. His feet tingled a lot, he said, but he was coping with it. 
James ended up in the emergency room again, dehydrated and in need of antibiotics. The doctor amputated the baby toe on his right foot, leaving a large open wound. 
"We're going to leave this open because we'll probably have to take more,” Angela remembered the doctor saying. “I didn't like that we're not going to try to save anything, we're just going to start cutting.”
James was fading.
His arm muscles shriveled and he lost his Popeye physique. Antibiotics left him looking sickly, his voice so weak Angela could barely hear him. “I felt like I was watching my husband slowly dying,” she said.
Finally, taking her doctor sister’s advice, Angela emailed Dr. Foluso Fakorede’s office to ask for an appointment. She thought it would take months to get James in to see the heart disease specialist, but the office called and asked if they could come the next day. 
The Hayneses would end up going back to see Fakorede many times − sometimes twice in one week, driving more than five hours each way from Gulfport north to Cleveland, Mississippi.
“We started looking forward to these visits because there was always hope,” Angela Haynes said, though she felt guilty they were taking up so much of the important doctor’s time. 
Fakorede, who is on a personal mission to save people with diabetes from amputations, noticed what other doctors had missed. Haynes had blockages in blood vessels on both legs. 
Once he got the blood flowing again, Haynes began to feel better. His flesh returned to its normal color. The wound started healing at last. Walking became easier.
Then disaster struck again. 
On July 2, 2022, Haynes caught COVID-19. "Everything went downhill after that," he said.
During his 13-day illness, the bacteria in his foot raged out of control. He ended up back in the hospital and unable to withstand the long drive to Fakorede’s office.
Every week, a surgeon would come to the door of his hospital room and before even stepping all the way in ask Haynes whether he had decided to get his leg amputated. 
"This is my leg. I was born with this. And you're walking in like you're cutting a piece of cake," Haynes said.
He was worried about how he’d get around, how he’d be able to work to support his family if he had only one leg. No one took the time to explain why they thought the leg needed to come off or how he’d cope without it, Haynes said. 
In late November, he was finally sent home in a wheelchair. But just three weeks later, as he was getting out of the car after wound care, his right leg gave out and he fell to the ground. Back at the hospital, Haynes was told his foot was broken, essentially beyond repair. He agreed to a below-the-knee amputation.
Released right before Christmas, he spent the next three weeks in bed wondering how he’d manage the rest of his life.
Finally, it looked as if his luck might be turning around.
With the leg gone, his diabetes improved. His blood sugar dropped into the 120s or one-teens. His blurry vision cleared up.
During his long hospital stay, he befriended nurses and learned about a program for people who needed prostheses. The man who ran it called early in the year and said he had received a donated leg. If it fit Haynes, he could have it while waiting for insurance to pay for a personalized one. Miraculously, it did. 
Haynes spent the next six months teaching himself to walk again. The donor leg was heavy and uncomfortable. He wasn't mobile enough to hold down a job.
One late spring night, picking up dinner at a nearby restaurant, he headed to the bathroom for a pit stop. A sink had been leaking all day and Haynes slipped in the puddle, falling backward.
He's still recovering from the resulting wrist surgery.
He and Angela are living – barely – off her part-time salary as a secretary and a church organist.
Haynes has tried "at least three or four times" to receive government assistance, but they keep losing his paperwork, or not believing he's disabled, though he once checked himself out of the hospital and arrived at an appointment in his wheelchair to prove he didn't have a leg.
Still, he clings to his faith and the positive attitude he has long used to cheer up himself and others. These are his secret weapons against diabetes and everything else life throws his way.
"I try to put a smile on other people's faces," he said. "It keeps my day going."
Contributing: Nada Hassanein
This story is part of a reporting fellowship sponsored by the Association of Health Care Journalists and supported by the Commonwealth Fund.
Contact Karen Weintraub at kweintraub@usatoday.com and Adrianna Rodriguez at adrodriguez@usatoday.com.
Health and patient safety coverage at USA TODAY is made possible in part by a grant from the Masimo Foundation for Ethics, Innovation and Competition in Healthcare. The Masimo Foundation does not provide editorial input.
The USA TODAY Best-selling Booklist is back!
After a brief hiatus, USA TODAY’s beloved bestsellers list has returned with the features and characteristics that have long made it the People’s Booklist.
Our goal remains the same: Provide book lovers with the best, most accurate snapshot of what people are reading by showing which titles are selling. It is a master list, unbound by genre and format, of what’s selling broadly across the U.S.
“I am so thrilled that the USA Today Best-selling Booklist is coming back!" says bestselling author Colleen Hoover in a statement. "It gives so many authors the wonderful opportunity to be recognized as bestsellers and for readers to discover their next favorite book.”
Hoover, the self-published writer turned bestselling powerhouse who's authored dozens of novels including "It Ends With Us" and "Verity," was the undisputed queen of the Booklist in 2022 and spent weeks atop the list. Her novel "It Starts With Us" claimed the No. 1 spot in its first week, her highest debut ever, selling more than 800,000 copies on its first day of sales. It was her fourth book to hit No. 1 in 2022.
Check out: USA TODAY's weekly Best-selling Booklist
The USA TODAY list is a ranking of the top-selling titles each week from a broad range of businesses including major chains, independent bookstores and online retailers. It reflects combined sales of titles in print and electronic format, if available. Our data team weighs and compiles those numbers to generate the week's 150 top-selling titles. The rankings reflect sales from the previous Monday through Sunday. The full list will publish online at 6 a.m. Wednesdays, with the top 50 titles publishing in print Thursdays.
The list, which began in 1993, went on hiatus in December. It is the longest-running USA TODAY data journalism project.
In our continued commitment to bring readers more books coverage, USA TODAY is also excited to announce a new content partnership with The Novel Neighbor, an independently owned and operated bookstore in St. Louis. They are expert booksellers and passionate readers who are deeply connected to what their community is reading. With the partnership will come regular profiles of independent bookstores across the country, highlighting the important role of these businesses in their local communities. Novel Neighbor will also be sharing expert book recommendations and fun takes on book trends.
We can't wait to see what you've been reading!
A year ago, President Joe Biden’s plan was to forgive up to $20,000 in student loan debt for tens of millions of Americans. 
With that plan now extinct, the first of several conversations to hash out a new strategy for erasing loan balances en masse began Tuesday and continues Wednesday.  
"Creating clearer regulations will ensure the authority to waive student debt is used in a fair and lawful manner," said James Kvaal, under secretary of education said Tuesday, as the first of three of these two-day talks began. "We believe that doing so will strengthen the entire student loan system, help us tackle pervasive problems in the system, and help ensure postsecondary education is a path to opportunity for more students."
As the process of negotiated rulemaking, or neg reg as it’s sometimes called in federalese, gets underway, tens of millions of Americans are wrestling with student loan payments for the first time in more than three years. Social media is littered with evidence of confusion about the size of monthly payments. Some people say they are puzzled about why they are being billed at all. One set of borrowers has their payments set to zero because of a new federal repayment option called SAVE that aims to be more generous than any other.
The negotiators resume their conversation at 10 am Eastern time Wednesday, and it will be livestreamed with a chance for the public to weigh in. Here’s what you need to know:  
Another legal challenge:Biden student loan debt forgiveness plan for 804,000 borrowers faces another day in court
The process the Biden administration has turned to is called negotiated rulemaking. It has been used many times over the years to draft rules related to higher education, including on how Title IX law on sexual assault is applied at schools and colleges and how well colleges produce graduates whose jobs can cover their student debt.
The people who will hash out the student loan plan applied or were nominated to participate and then were selected by the Education Department. They represent different groups who have a stake in student loans, such as borrowers, student loan servicers and colleges and universities. Some of the members include Wisdom Cole, national director of the NAACP Youth & College Division; Yael Shavit, an assistant attorney general in the Consumer Protection Division of the Massachusetts Attorney General's Office; and Jada Stanford, a student at Stephen F. Austin State University in Texas. 
This is a list of the committee members, including alternates, selected ahead of Tuesday's meeting. But on the first day, the committee chose to add representatives of two additional groups – consumer advocates and individuals with disabilities.
Their meeting agenda doesn't give very much away. But the focus of the virtual meeting is wide-reaching, with discussion reserved for each of the five guiding questions mapped out by the department. 
The questions are described in this issue paper published late last month. They are, in short:
Public comment comes at the end of each day of conversation. To sign up to speak, send your name and, if applicable, organization to negreghearing@ed.gov no later than noon Eastern time on each meeting day. 
On Tuesday, negotiators focused on questions No. 1 and 2 – how to better support borrowers with outsize balances and better engage borrowers who are eligible for forgiveness but haven’t applied. The discussion was civil, though at times it meandered into territory not technically covered by this neg reg process. Some, for example, focused on the need to ease burdens on parents who took out student loans on behalf of their kids, known as Parent PLUS loans, which are not eligible for most income-driven repayment options. Others highlighted obstacles to participating in the public service loan forgiveness program. 
Four takeaways from the day’s discussion:
The negotiators have to come up with a plan to which every committee member has to agree. If they don’t arrive at a consensus, the Education Department will come up with its own proposal. Either way, there will be another opportunity for the public to comment on what is developed before it’s finalized. Congress will then have the opportunity to review the rule, and has the option of passing a joint resolution to overturn it. 
A final rule must be published by Nov. 1 for it to take effect in July of the following year. This rulemaking schedule is a big reason the Biden administration is so intent on publishing a rule developed under its Education Department. If the process goes according to plan, the earliest borrowers would see forgiveness is summer of 2024. 
When the Supreme Court struck down Biden’s original plan this past summer, it ruled that student loan debt relief could not happen through the president’s executive authorities the way he’d hoped. That means the only viable routes are through federal legislation – which given partisan gridlock is all but impossible – or federal higher education policy changes, a.k.a. neg reg. 
If a rule isn’t finalized through this neg reg series and a Republican wins next year’s presidential election, the chances of broad student loan forgiveness becoming reality are even slimmer. 
First, sign up to watch the negotiators discuss policies that could make large-scale loan forgiveness a reality. You’ll need to register at this link. 
The first meeting spans over two days, Tuesday and Wednesday, for five hours each – from 10 am to noon Eastern, then 1 pm to 4 pm.
The next meeting is scheduled for Nov. 6-7, and the one after that for Dec. 11-12. Both of the sessions, like the one that kicks off Tuesday, will be virtual and include opportunities for the public to comment. The links to register will be different for the next two sessions.
Biden has a Plan Bfor mass student loan forgiveness. It could be excruciatingly long
Bar Pereg spent the early hours of the morning Saturday glued to her phone, tracking her sisters’ location as they fled from the rockets raining down on Israel. 
The 37-year-old New Yorker initially thought little of the attack. With seven decades of war and conflict between Palestinians and Israelis, rockets aren’t uncommon in the region. But Pereg soon learned from her sisters’ WhatsApp messages that this time, things were different. 
The two sisters decided to risk car rides to a safer location, fearing the situation would take a turn for the worse in their kibbutz near Gaza.
“I asked them to share their location so I could track them, and I just sat there and watched,” Pereg said, noting that they took off around 4:30 a.m. EDT. Once they reached a highway, Pereg alternated 20-minute phone calls with each sister to make sure they were safe and didn’t fall asleep at the wheel. 
“The fact that I could hear their voices, see their location, it was the difference between a complete freakout or crippling fear but with really clear hope,” Pereg said. “It made all the difference.”
People across the United States have turned to communication channels like WhatsApp to get updates from friends and family in Israel amid the war, which has so far led to more than 900 dead in Israel, upward of 680 dead in Gaza and at least 14 dead Americans. Dozens more Israelis and an unknown number of Americans have been taken hostage and are being held in locations across Gaza.
While experts warn that social media sites can be rife with disinformation during crises, they have also become a lifeline for Americans concerned about loved ones thousands of miles away. 
Linda Mildwurf, 52 of Raleigh, North Carolina, has been in constant communication with her 20-year-old daughter through WhatsApp since the conflict began.
Mildwurf’s daughter is a “lone soldier,” a designation in the Israel Defense Forces whose parents do not live in Israel. Mildwurf asked that her daughter not be named to avoid targeted attacks by Hamas militants.
When she's not checking on her daughter and sending encouraging texts, Mildwurf spends her time on WhatsApp finding solace in a lone soldiers' mothers group, where members update each other on the status of their children. 
“Our job is to protect them. They’re our kids. And these are just kids, at the end of the day,” Mildwurf said. “And there's nothing that we can do. Literally, the only thing we have is to be able to talk to them through WhatsApp.”
Itzik Elyahou, 37 of California, was at a mindfulness retreat with limited internet access over the weekend and didn’t learn about the war until Sunday.
When he connected his phone to Wi-Fi, he said he discovered approximately 70 WhatsApp messages from friends and family in Israel. He raced back home after learning about the war and sorted through the news after a “really hard” two-hour drive.
“I didn’t know who was dead or kidnapped. That was super challenging,” he said, adding that his immediate family and close friends are safe. At the retreat, “I was at this peak of the universe, feeling everything is possible. We’re all one, we’re all together. Then you go back to reality.”
Boris Meyerovich, a 33-year-old Israeli living in Austin, Texas, was in Israel last week to visit friends and family. He landed in Texas with his wife and son on Friday and woke up jetlagged in the middle of the night to find notifications flooding his phone from WhatsApp, Instagram and Telegram.
“Everywhere, it was chaos. People were asking each other are you good? Are you fine?” he said.  
“Like 9/11 for the U.S., that’s how it feels for me," he added. "It’s horrible. It’s the darkest, darkest days of our lives."
He keeps in contact with his mother “a few times a day” and gets updates from his friends in WhatsApp groups. While Meyerovich said his family has reported rockets flying about their house, they remain safe.
Debbie Secan, a 53-year-old Raleigh, North Carolina, resident who lived in Israel while in her 20s, has been communicating with friends through WhatsApp and Facebook Messenger since the attack started. 
“I’m just grateful that I can send love,” she said. "The one thing I’m getting is that they’re all very scared and shocked.”
Israel-Hamas war:Israel, Gaza and when your social media posts hurt more than help
While social media sites have been able to help connect families amid the crisis, they have also been flooded with misinformation.
False stories have already spread on sites like Facebook and X, formerly Twitter, with users posting old videos or video game clips and passing them off as updates from the Israel-Hamas war.  
“You have to be a bit more careful when you consume content,” said Dina Sadek, a Middle East research fellow at the Atlantic Council’s Digital Forensic Research Lab. “Right now, there's widespread misinformation and disinformation.”
Social media to blame?:Online hate surges after Hamas attacks Israel. Why everyone is blaming social media.
The Israel-Hamas war isn’t the first conflict where social media has been used to spread propaganda, but some experts say managing misinformation online today is harder than ever before. 
Developments in artificial intelligence could influence propaganda if the Israel-Hamas war drags on, according to Claire Wardle, co-director of the Information Futures Lab at Brown University, which studies misinformation. 
Wardle also noted that in just the past few months, Elon Musk's X has made it harder to recognize verified journalists and layoffs among tech companies like Google parent company Alphabet and Facebook parent company Meta have reportedly affected teams focused on internet trust and safety.  
“It was always going to be a difficult situation, and then you add on the world's most complex conflict, which is Israel and Palestine and Gaza. And what we're seeing is what we would expect, but it's made so much worse on Twitter, X, in particular, because of the complete breakdown of the lack of verification processes,” Wardle said.
“I don't think the platforms are prepared,” she added. 
There’s a horrific war going on between Israel and Gaza. Many of us have been glued to the nonstop news coverage and social media feed as the horror unfolds before our eyes. The question for all of us is how can we respond in a way that will bring hope and peace as opposed to more bloodshed and persecution.
The two of us have a long history of working with and alongside each other in community organizing and social justice work in and around Chicago. We also just returned home from an absolutely transformative journey in Jerusalem and its surrounding area with a phenomenal interfaith group of community leaders, scholars, artists and others.
Our journey lasted for two weeks. The last day of the trip coincided with horrific violence and attacks inside Israel on Saturday that have led to yet another round of aerial bombardment and an inhumane blockade on Gaza. Our group experienced the direct horror of indiscriminate rockets being fired from Gaza into Israel as we ran for cover with people of all faiths and backgrounds at Tel Aviv’s Ben Gurion Airport.
Our own fear and the fear of those who were sheltered with us was palpable. We knew that wherever these other travelers were headed, this trauma would be carried with them and have an impact on communities across the globe and geopolitics. We tried to comfort ourselves and others around us as we searched for a safe way home, eventually crossing into Jordan to catch flights back to America.
The stories of ghastly attacks by Hamas are gut-wrenching to watch, and there is nothing in our understanding of our faiths and righteous pursuits for justice that justify such horror. We know that these brutal images and stories bring up deep-seated trauma for the Jewish community and worry and sadness for the many who have been killed, injured and taken captive.
Meanwhile, the carnage and blockade being imposed upon the civilian population in the Gaza Strip by an overwhelming military force is barbaric and inhumane – and yet not often condemned by the world. The attacks on and closure of Gaza will certainly lead to the deaths of innocent children.
