The CPI is the most prominent of these metrics. Released by the US Bureau of Labor Statistics, the consumer price index measures the prices of goods in an urban market, which represents over 90% of the American public.
The CPI looks at a 'fixed basket' of some 80,000 goods and services to come up with these numbers. What gets put in that basket depends on the consumer expenditures survey which polls Americans to determine which goods are important. The importance of those goods then determines their weight in the CPI– for example, the price of something like gasoline, which forms an integral part of many people’s cost of living, will contribute more than other items.
The CPI does not just have one version though.
Another version – the chained consumer price Index for all urban consumers is used to adjust tax brackets. The virtue of the chained CPI is that it takes into account the product substitutions shoppers make, which happens often when prices go up amid inflation. In doing this, it provides a more accurate look at consumer spending and doesn’t overstate inflation.
Inflation can also be measured through the price index for personal consumption expenditures (PCE). This metric, released by the Bureau of Economic Analysis, takes a more holistic view. Rather than calculating the change in prices for goods paid solely out of pocket for consumers, the PCE takes into account all expenses, including health care coverage compensated by insurance or the government.
The PCE is what the Fed uses as its gold standard measure of inflation.
The final piece of the puzzle to factor in is ‘core inflation.’ This is a term used by economists to reflect the rate of inflation, excluding prices for food and energy which are notoriously variable.
Inflation is both good and bad, Bivens said. However if rates of inflation are consistent, positive and low, they can be beneficial, he added. 
"Inflation is sort of greasing the wheels of the labor market," he said. "It is a way to do some adjustments without actually having to cut nominal wages, and the economy just seems to operate better like that."
If inflation goes beyond its target percentage, though, it can cause uncertainty within the market. 
"Whatever your target is, you don't want to go really far above that. You want people to be able to make plans and have a predictable sense of how much prices and wages will rise over the next year," Bivens said.
In order to control inflation, one of the Federal Reserve's main tools is the federal funds rate, which is the rate banks charge each other for overnight loans. If that rate rises, banks generally pass on their additional cost to customers.
Even though the Fed does not directly control all interest rates in the country, when it raises the fed funds rate, other interest rates eventually follow, including adjustable-rate mortgages, credit cards, home equity lines of credit, and other loans.
Higher rates curb borrowing and spending, cool off an overheated economy and fend off inflation spikes.
Whoever is spending most on goods or services can be negatively impacted by inflation. 
For instance, when gas or food prices are inflated, low- and moderate-income families are hurt since they spend a higher share of total income on energy and food, said Bivens. 
Inflation and recession are strongly related, said Bivens. 
High inflation can cause consumers to cut spending and prompt the Fed to raise interest rates - both of which can lead to a downturn. That can result in easing price increases.
"A big rise in the unemployment rate is going to put a lot of downward pressure on inflation," he said. "As the economy slows, inflationary pressures tend to relent." 
A recession isn’t determined by a negative quarter of gross domestic product or even two for that matter. Rather, it’s a significant decline in economic activity resulting from several factors, including high unemployment, a slowdown of goods produced and sold, and wages falling in addition to negative GDP readings.
That’s according to the National Bureau of Economic Research, which gives the official ruling on when a U.S. recession starts and ends.
So, inflation could produce a recession, but it is not a definite outcome.
Consumers were rocked by surging food prices last year. In July, the cost of groceries rose 0.3%. This, however, still pushed down the yearly increase to 3.6%.
The price of rice and bread both rose 0.9%, uncooked ground beef increased 1.5% while cookies rose 0.8%.
Chicken and fish prices both fell 1.1%, bacon was down 0.7% and eggs declined 2.2%. This was the fifth straight monthly decrease for eggs after a series of sharp bird flu-related increases, and costs are now down 13.7% over the last year.
Costs to dine out are up 7.1% over the past year.
Much like other aspects of the economy, inflation can cause a raise in prices for rent as well. And in May, housing costs were the biggest contributor to inflation, according to the Bureau of Labor Statistics.
However, increases have somewhat slowed down. Rent went up 0.4% in July but this is less than previous stronger increases. Annually, rent eased to 8%, according to the CPI report.
The consumer price index, or CPI, measures the average change over time in the prices paid by consumers for a variety of different consumer goods and services, according to the U.S. Bureau of Labor Statistics. Core prices exclude volatile food and energy items and generally provide a better measure of longer-term trends. 
They were up 0.2% in July. This left the annual increase at 4.7%, down just slightly from June’s 4.8% increase and well above the Fed's 2% target.
Baked potatoes are an autumn staple, especially as we make our way into the football and holiday seasons. They make a great party snack or an easy weeknight dinner – you could even try this loaded baked potato skin board or loaded baked potato soup to impress your friends and family. 
Here are a few quick tricks to keep up your sleeve for the next time you’re craving a baked potato, including cooking temperatures to know and topping ideas to try.
Internal temperature isn’t as crucial for a potato as it is for meat, but you’ll still want a baked potato to reach around 210 degrees, the Idaho Potato Commission advises. If you want to let residual heat do the rest of the cooking for you, you can take your potato out of the oven after it reaches 185 degrees. 
But beyond exact temperatures, the best way to tell if a potato is done is by sticking a fork or knife into it – if it slides through the potato easily, it’s good to go. 
This will take between 45 minutes to an hour in a 400-degree oven, according to the Food Network. If you want to speed up the cooking process, throw the potato in the microwave for a few minutes before placing it in the oven. 
You can also bake a potato in the air fryer by setting it to 375 degrees and letting your potato cook for 50 minutes to an hour.
Boiling your potatoes?:How long it takes to cook those spuds properly
Making a baked potato is simple, but there are a few things to keep in mind. Here’s how to do it right:
How you top your baked potato is up to you: Are you content with salt, pepper and sour cream? Do you load up your baked potato with chives and bacon? Butter or olive oil is essential, but the possibilities are endless with other toppings. Here are a few favorites to consider:
Microwaving a potato to baked perfection is a serious time saver, but some people are die-hard oven enthusiasts. First, poke holes in your potato with a fork to release the steam, then cover it with oil and seasonings. Place your potato in a microwave-safe dish and cook for 5 minutes in the microwave for one potato, or 5 to 7 minutes for two potatoes. Flip the potatoes and cook them for another 3 minutes, the Food Network suggests. 
Crispy Parmesan roasted potatoes:Try this one pan, delicious weeknight meal
USA TODAY is exploring the questions you and others ask every day. From "What is the healthiest vegetable?" to "How to clean an air fryer" to "Why does my cat bite me?", we're striving to find answers to the most common questions you ask every day. Head to our Just Curious section to see what else we can answer for you. 
"Going gray" is something few men try to prevent and some are even proud of. For women, it's often a different story. While only 31% of men pluck their gray hairs when they first start appearing, 82% of women do the same, per one clinical survey. Women also turn to dyeing or coloring their hair more often than men do − with approximately half of them doing so, according to one report. 
Such efforts are often employed to hide signs of getting older, but age isn't always the only factor at play. While most people start getting gray hairs in their mid to late 30s, others do so much earlier, showing that age alone isn't the culprit behind hair changing color. Experts weigh in on what these other causes are and whether there's anything you can do to keep the gray hairs at bay. 
Graying hair is what happens when color-producing cells in the body stop producing a natural pigment known as melanin. That happens naturally with age in most people, but graying and premature graying can also happen due to "some environmental triggers," explains Shari Lipner, MD, an associate professor of clinical dermatology at the Weill Cornell Medical Center. 
Such triggers include overexposure to sunlight as UV rays can create free radicals that damage the cells that give hair its color. Vitamin B12 deficiency can also cause premature graying in some people. "And smokers compared to non-smokers have increased risk of graying," adds Lipner. The National Institutes of Health has published a report showing that stress can also cause one's hair to prematurely turn gray. 
More common than environmental or behavioral factors though, the timing of one's hair turning gray "is mostly driven by genetics," says Angela Lamb, MD, a dermatologist at Mount Sinai in New York City. "Sure, you might be the first person in your family that you know that is going gray prematurely," she explains, "but the research supports that it is predominately genetically driven." 
Once that change begins taking place many are eager to know: can you stop it from progressing or even prevent it from happening altogether? The short answer is no, not absolutely. But as the saying goes, "though you can't change your genes, you can change your behavior," and certain behaviors can impact both the timing and the degree to which one's hair turns gray. 
"Some things that can help include maintaining a balanced diet, ensuring adequate intake of essential vitamins and minerals − particularly vitamin B12 and folic acid − and refraining from smoking," advises Michelle Henry, MD, a board certified and Harvard trained dermatologist. 
She also recommends limiting exposure to environmental pollutants that can cause oxidative stress or create free radicals "that could harm hair or accelerate graying."
Others want to know if it's possible to get their color back after their hair has already turned gray. There again, it depends on a couple of factors. If one's hair changing color is the result of genes, than there's nothing you can do to permanently reverse the change. But if it's been caused by nutritional deficiencies or a medical condition like thyroid disease, improving such deficiencies or treating the condition may prove helpful. 
And when stress is the culprit, research shows and the experts say there may be a window of opportunity to reverse the graying hair once it first starts turning if stress levels are brought back down. In such cases, "manage stress through relaxation techniques like meditation or yoga," suggests Henry. 
If stress isn't the issue, however, or if you're worried that you're graying earlier than family members your age or because of something else, a conversation with your doctor may be in order. "If premature graying concerns you," Henry advises, "consult your healthcare professional to rule out any underlying medical conditions." 
More:Pamela Anderson's bold no-makeup look and the 'natural beauty revolution'
So California’s liberal Gov. Gavin Newsom has enacted a law known as the “Skittles Ban,” and it cruelly attacks the four thing all righteous Americans hold dear: brominated vegetable oil, potassium bromate, propylparaben and Red Dye 3.
The law will ban the sale, distribution and production of these traditionally delicious food additives, which are used in thousands of products we eagerly put in our mouths. Newsom’s attack on tastiness doesn’t actually impact Skittles – thank the rainbow! – because brave candy advocates persuaded lawmakers to exclude titanium dioxide from the list of banned additives. (Everyone knows it’s the titanium dioxide that gives Skittles their flavorful pop.)
Still, the four unjustly targeted additives will require producers of certain food-like comestibles to change recipes by 2027 if they want to sell their products in the most-populated state in the country.
What kind of newfangled communism is this? And since when does a governor have the power to tell me when and where I can guzzle brominated vegetable oil?
Here are a few of the endangered products: Peeps; Pez; Fruit By the Foot; Hostess Ding Dongs; Brach’s Candy Corn; and Yoo-hoo Strawberry Drink.
THAT’S MY FOOD PYRAMID, YOU NANNY STATE MONSTER!!!
Like most sensible patriots, I start each day pounding five seasonally appropriate Peeps and washing the marshmallow-like goop down with a bottle of Strawberry Yoo-hoo, the only beverage bold enough to look like milk while actually being water and high-fructose corn syrup.
It’s delicious, nutritious-ish and causes an insulin surge that keeps the walls of my arteries in a state of constant inflammation or, as I like to call it, “readiness.”
But Newsom and his propylparaben police want to rob me of that breakfast tradition. Am I now supposed to start eating fruit NOT by the foot?!?
Brian Ronholm, director of food policy at Consumer Reports, said in a statement about the new California law: “We’ve known for years that the toxic chemicals banned under California’s landmark new law pose serious risks to our health. By keeping these dangerous chemicals out of food sold in the state, this groundbreaking law will protect Californians and encourage manufacturers to make food safer for everyone.”
Well, lah-di-dah. I don’t recall asking for government protection from chemicals I don’t understand and didn’t technically realize I’m eating. But if you think knowing that Red Dye 3 has been found to cause cancer in animals and has been banned from use in cosmetics for more than three decades would stop me from making my annual Thanksgiving candy corn casserole, think again.
Look, California, if I’m Hoover-ing Pez into my pie-hole and washing Ding Dongs down with Yoo-hoo, as is my God-given right as a corn-syrup-based citizen of this world, I’ve pretty much committed to a ride-or-die lifestyle.
So you’re going to have to pry the Peeps and potassium bromate from my cold, dead, Red-Dye-3-stained hands. Which, according to these actuarial tables, you should be able to do in about a month and a half.
Follow USA TODAY columnist Rex Huppke on X, formerly Twitter, @RexHuppke and Facebook facebook.com/RexIsAJerk
There’s a horrific war going on between Israel and Gaza. Many of us have been glued to the nonstop news coverage and social media feed as the horror unfolds before our eyes. The question for all of us is how can we respond in a way that will bring hope and peace as opposed to more bloodshed and persecution.
The two of us have a long history of working with and alongside each other in community organizing and social justice work in and around Chicago. We also just returned home from an absolutely transformative journey in Jerusalem and its surrounding area with a phenomenal interfaith group of community leaders, scholars, artists and others.
Our journey lasted for two weeks. The last day of the trip coincided with horrific violence and attacks inside Israel on Saturday that have led to yet another round of aerial bombardment and an inhumane blockade on Gaza. Our group experienced the direct horror of indiscriminate rockets being fired from Gaza into Israel as we ran for cover with people of all faiths and backgrounds at Tel Aviv’s Ben Gurion Airport.
Our own fear and the fear of those who were sheltered with us was palpable. We knew that wherever these other travelers were headed, this trauma would be carried with them and have an impact on communities across the globe and geopolitics. We tried to comfort ourselves and others around us as we searched for a safe way home, eventually crossing into Jordan to catch flights back to America.
The stories of ghastly attacks by Hamas are gut-wrenching to watch, and there is nothing in our understanding of our faiths and righteous pursuits for justice that justify such horror. We know that these brutal images and stories bring up deep-seated trauma for the Jewish community and worry and sadness for the many who have been killed, injured and taken captive.
Meanwhile, the carnage and blockade being imposed upon the civilian population in the Gaza Strip by an overwhelming military force is barbaric and inhumane – and yet not often condemned by the world. The attacks on and closure of Gaza will certainly lead to the deaths of innocent children.
While in Jerusalem, our multifaith group had the opportunity to connect to the Jewish traditions of Sukkot (the weeklong fall harvest festival), attend Shabbat dinner, sit through a soaring church service on the Mount of Olives and attend powerful outdoor Friday prayers along the road to Tiberias.  
We leaned into one another’s rich spiritual backgrounds and commitments to justice, mercy and peace by exploring underappreciated connections to this sacred land, and in so doing, tried to forge another path for radical empathy and connection to the stories, hopes and aspirations of those working for and dreaming of more dignified pathways for all people on this land.
Attack timing desecrates our religion:Hamas took advantage of divisions in Israel to start a horrific war targeting civilians
Throughout our journey, we were reminded of the daily humiliation, hardship and injustice experienced by Palestinians living under military occupation in refugee camps and surrounding areas. In Jerusalem, we heard of forced evictions, home demolitions and a widescale system of harassment and abuse that make life unbearable for most Palestinian families struggling to survive.
While none of that justifies the carnage of innocent civilians, it must be understood as the ongoing context in which decades-old Palestinian grievances are being ignored or exploited. 
Now back in Chicago, we know our work will soon return to the issues that connected us before this journey together: social, racial and economic justice and equity in our city and ways to bring faith and other communities together around a larger vision for a more just and equitable Chicago.
Meanwhile, we cannot forget what we experienced together in the Middle East, especially at a time when much of America and news outlets seem to be cheering on Israel’s blockade and bombardment of one of the most densely populated and essentially imprisoned populations in the world. 
We pray for the healthy return for all Israeli children, families and others taken hostage in the Gaza Strip as we pray for the cessation of collective punishment upon innocent Palestinian families.
We call upon our politicians to support an immediate end to the full blockade on Gaza and a humanitarian corridor for relief for families inside Gaza. Among the things we were reminded of by many people of all faiths and backgrounds on this journey is the interconnected and interwoven reality of all our collective experiences, suffering and dreams for justice. 
'Stand with Israel'?:Biden's response to Hamas terror attack was weak. Trump talked about hummus.
We are also concerned about the safety of Muslim and Jewish communities here in the United States as tensions flare in Israel and Gaza. Some parts of both communities are receiving threats at this time.
Palestinian people are not the enemy; Jewish people are not the enemy. The true enemy is any ideology that degrades and diminishes the sacred light resident in all humanity.
We recognize the fear, anger and helplessness so many feel at this precarious and violent time, but our traditions teach us to turn to prayer, loving support of one another, and working for justice and peace as outlets for these feelings and not violence.
We must stand up for the safety and security of everyone. Our hearts break for all who live under the threat of terror and sit under the canopy of hopelessness. We call upon our religious leaders, politicians and communities to stand together for justice and peace and not resort to sloganeering or jingoism at this time.
In a sacred land filled with so much sorrow, death and destruction now, we recall the powerful words of Palestinian American poet Suheir Hammad:
There is death here, and there are promises of more. There is life here. Anyone reading this is breathing, maybe hurting, but breathing for sure. And if there is any light to come, it will shine from the eyes of those who look for peace and justice after the rubble and rhetoric are cleared and the phoenix has risen.
Affirm life. Affirm life. We have got to carry each other now. You are either with life, or against it. Affirm life.
May more of us of all backgrounds dig deep into the highest ideals and practices of our traditions so we can truly radiate the divine light of truth, justice and mercy so desperately needed now in Gaza, in Jerusalem, across this ancient holy land, here in Chicago, and across the globe.
Rami Nashashibi, a MacArthur Foundation fellow, is founder and executive director of the Inner-City Muslim Action Network. Rabbi Andrea C. London of Beth Emet The Free Synagogue is a nationally recognized Jewish leader who has forged close ties with congregants and community members of all age groups and walks of life.
On the high seas hundreds of miles north of the Falkland Islands, a group of Western reporters boarded a Chinese fishing ship where deckhands pulled them into a dark hallway begging for help, saying they were being held against their will.
While in Uruguay, these same reporters unearthed data showing that for much of the past decade, one dead body per month has been dropped off fishing ships, mostly Chinese, on the docks in Montevideo, often with signs of severe neglect or abuse.
For four years, these reporters, from a journalism organization called The Outlaw Ocean Project, quietly, always with captains’ permission, boarded Chinese fishing ships on the high seas and in national waters all over the world – near the Galapagos Islands, near the sea border with North Korea, along the coast of West Africa – for the sake of inspecting working conditions.
They uncovered myriad abuses, including forced labor, debt bondage, wage withholding, excessive working hours, physical abuse, passport confiscation, the denial of medical care and even deaths.
And the abuse doesn’t end at sea.
As part of this same investigation, reporters discovered something even bigger and darker in China’s seafood processing plants. By using cellphone footage from inside the plants, deploying secret surveillance at factories and ports, and mining company documents and trade data, the reporters found that much of the seafood being exported to the United States and Europe from Chinese plants is processed by Uyghur workers – a highly repressed minority population whom the Chinese government detains in “reeducation” camps and forces to work in factories throughout the country.
The United States forbids the import of products made with forced labor, and it has specific laws prohibiting the import of any products made using Uyghur labor.
What 'Sound of Freedom' gets wrong:'Sound of Freedom' misleads audiences about the horrible reality of human trafficking
These new revelations about the global seafood industry have serious implications for American consumers and policymakers because more than 80% of the seafood consumed by Americans is imported, and the largest portion of that is caught by Chinese ships or processed in China's factories.
By some estimates, half of the fish sticks served in American public schools are processed in China. Fish tainted by Chinese forced labor is even showing up in military base cafeterias, federal prison canteens and veterans homes’ dining halls, paid for by federal and state tax dollars. Such seafood also lines the shelves of our major grocery stores, including Albertsons, Costco, Kroger and Walmart.
Even fish marketed as “locally caught” is tainted by these labor and human rights problems associated with China because much of the fish coming out of U.S. waters and onto U.S.-flagged ships is frozen, sent to China for processing, refrozen and shipped back to America. Like fish from Chinese vessels, many of the workers processing U.S.-caught seafood are also Uyghurs under state-sponsored forced labor regimes, meaning importation of this catch is also in clear violation of U.S. law.
I escaped modern slavery.Wouldn't you want to know if I made your shirt?
Solving problems within seafood industry supply chains is not easy because fishing ships are far from shore, almost always in motion, tough to spot-check, flagged to other nations and crewed mostly by poorer people from the global south who do these jobs with no contracts.
Even so, there are things that we as American consumers can do:
