The 2024 election cycle has kicked off. Though Election Day is over a year away, the race is well underway. 
President Joe Biden announced he will seek another term, and with former President Donald Trump's hat also in the ring, a rematch of their 2020 race is a real possibility. Though the Democratic establishment is expected to fall firmly behind Biden, the Republican side is more of a toss-up. 
Trump-endorsed candidates suffered in the midterm elections, and with his legal troubles mounting, the GOP may consider other options. Polls still show Trump with a strong lead however, and many of those trying to unseat him have floundered including Florida Gov. Ron DeSantis.
DeSantis who generated early buzz has suffered in the polls, struggling to translate popularity in Florida to popularity at the national level, and recently firing much of his campaign staff in a major shake-up.
Here are the latest developments on the path to the 2024 election: 
And here are the candidates who have announced their intention to run for president in the 2024 election: 
Joe Biden ∣ Robert F. Kennedy Jr. ∣ Marianne Williamson ∣ Ryan Binkley ∣ Doug Burgum ∣ Chris Christie ∣ Ron DeSantis ∣ Larry Elder ∣ Nikki Haley ∣ Will Hurd ∣ Asa Hutchinson ∣ Perry Johnson ∣ Mike Pence ∣ Vivek Ramaswamy ∣ Tim Scott ∣ Francis Suarez ∣ Donald Trump ∣ Cornel West
Political party: Democrat
Age: 80
Family: Biden has spoken candidly about grief throughout his political career. He lost his first wife Neilia Hunter and their one-year-old daughter Naomi in a 1972 car accident shortly after winning his first Senate race. His two young sons, Beau and Hunter, were injured in the crash but survived. In 2015, Biden lost Beau to brain cancer and has made it a major political goal to champion cancer research.
He remarried in 1977, tying the knot with now-First Lady Jill Biden. The two share a daughter, Ashley, and a large clan of grandchildren.
Biden's son Hunter has been the subject of scandal in recent years and has written about his struggles with drug addiction. The GOP-led House has seized on Hunter's business dealings, hosting hearings to investigate his finances and the potential influence he has on his father.
Previous political experience: Joe Biden is a veteran of the Senate. First elected in 1972, he served as a senator from Delaware for 36 years before being elected as vice president on the Obama ticket in 2008.
After serving two terms as vice president, Biden took a brief hiatus from government work before returning to run, and win, in 2020.
His views: Biden's campaign is focused on the "battle for the soul of America," doubling down on the central message of his campaign four years ago. He said the question facing the nation is "whether, in the years ahead, we have more freedom or less freedom, more rights or fewer."
Political party: Democratic
Age: 70
Family: Williamson was married once in the late 1970s to a Houston businessman whom she has not named. She has one daughter, India Emmanuelle, whose father has not been publicly identified.
Previous political experience: Williamson is a self-help author and spiritual leader who ran unsuccessfully for president in 2020. Then she was largely drowned out by a crowded Democratic field, breaking through for a rare viral moment, but eventually written off as a non-traditional candidate whose views involved centering the "politics of love" and rejecting a “dark psychic force of collectivized hatred.”
Her views: Williamson supports abortion rights, a single-payer health care system and reparations for descendants of formerly enslaved Americans. She has suggested creating a U.S. Department of Children and Youth to increase child advocacy, and a U.S. Department of Peace.
Party: Republican
Age: 55
Family: Binkley met wife Ellie in college and the two share five children.
Previous political experience: Binkley is CEO, president, and co-founder of the mergers and acquisitions conglomerate Generational Equity Group. He is also a faith leader, having co-founded and serving as the pastor at Create Church in Richardson, Texas. 
The 2024 run is Binkley's first foray into politics. He says he wants to stand out in a crowded field by prioritizing unity, and leaning on his faith and business experience.
His views: Binkley has said he hopes to prioritize balancing the budget, lowering health care costs, creating bipartisan immigration reform, and putting more community emphasis on education. Binkley is against abortion. Though he signed a highly restrictive bill in his own state, he had indicated he would not do the same nationally and it should be a local issue. Binkley advocates for American energy independence using an "all of the above" approach that encompasses both fossil fuels and new technologies.
Political party: Republican
Age: 66
Family: Burgum wed Karen Stoker in 1991 and the two had three children: Joe, Tom, and Jesse before divorcing in 2003. He remarried in 2016, tying the knot with current wife Kathryn.
Previous political experience: Burgum comes from a business background, once serving as SVP of Microsoft and founding both a real estate and venture capital firm. He was elected governor of North Dakota in 2016 and reelected in 2020.
Burgum’s candidacy is expected to focus more on economics than culture wars – a favored topic of frontrunners Trump and DeSantis.
His views: Burgum has emphasized economic issues, rather than hot-button cultural issues that have been a focal point for some other GOP candidates. He is a vocal supporter of the oil industry, and the U.S. role in exporting it to other nations, and has said he favors smaller government and lower taxes.
Party: Republican
Age: 60
Family: Christie met wife Mary Pat at the University of Delaware and the two wed in 1986. They share four children: Andrew, Sarah, Patrick and Bridget.
Previous political experience: Christie was appointed U.S. Attorney for the District of New Jersey in 2002 and served for six years. He was elected governor of New Jersey in 2010 and occupied the office until 2018.
Christie has been a prominent figure in the GOP since he launched his first presidential campaign in 2012. He ran again unsuccessfully in 2016 and, despite prior criticism, ultimately endorsed Trump and later joined his campaign.
His views: Christie is anti-abortion, but does support some exceptions in the case of incest, rape, and danger to the mother. He is not for a federal ban, instead believing the issue should be left to the states. He has advocated for a more secure border to stem the flow of fentanyl into the country and is in support of U.S. aid for Ukraine.
Political party: Republican
Age: 44
Family: The governor wed former television host Casey DeSantis in 2009 and the couple share two daughters Madison and Mamie and one son Mason.
Previous political experience: DeSantis serves as the 46th governor of Florida. His national profile grew during the pandemic when he spoke out publicly against mask mandates and pushed to keep many Florida businesses and schools open. Since then, he has captured national attention with controversial legislative measures on education and immigration.
While in law school, DeSantis joined the U.S. Navy as a JAG officer, later deploying to Iraq for active duty. Prior to his run for governor, he served in the House of Representatives as a congressman for Florida's 6th district for three terms from 2013 to 2018.  
He is widely viewed as Trump’s biggest threat in the Republican primary. Similar in politics but different in demeanor, DeSantis represents a younger, some say more predictable, alternative to the former president.
His views: DeSantis is campaigning on a hard-right agenda to make America look more like Florida. He is in favor of "defending parental rights and eliminating CRT," and is anti-abortion and pro-Second Amendment.
Political party: Republican
Age: 70
Family: Elder has no children and has been married once. The couple divorced after two years and Elder was engaged again to Alexandra Datig from 2013 to 2015. Amid his candidacy for California governor, Datig went public with an allegation that Elder had once brandished a gun at her while high on marijuana.
Previous political experience: Elder is a lawyer and conservative talk show host who mounted a campaign against California governor Gavin Newsom in 2021's recall election. Though he lost, Elder received the highest number of votes of any candidate besides Newsom.
Elder announced his candidacy on Fox News' "Tucker Carlson Tonight," tweeting afterward "America is in decline, but this decline is not inevitable. We can enter a new American Golden Age, but we must choose a leader who can bring us there. That’s why I’m running for President."
His views: Elder backs school choice, including vouchers and charter schools. His platform also includes a vow to be tough on crime, to secure the border, and to "contain China" by asserting military dominance in the South China Sea and minimizing reliance on the country's manufacturing.
Political party: Republican
Age: 51
Family: Haley is one of four children born to Indian-American parents in Bamberg, South Carolina - a town she has described as divided by race.
She and her husband of 26 years, Michael, live still in South Carolina where they are raising two children Rena and Nalin.
Previous political experience: Haley started her political career in the South Carolina state legislature where she served for 6 years before mounting a successful campaign for the governor's office in 2010. She won reelection in 2014 and has bragged that she has "never lost a race."
In 2016, former President Trump nominated Haley to be U.S. Ambassador to the United Nations, a position she held for a year before unexpectedly stepping down in 2018. Haley has played up her role as a female candidate in what is expected to be a largely male primary field. "May the best woman win,” she quipped in an interview with Fox News.
Her views: Haley is anti-abortion and pro-Israel. She supports cracking down on illegal immigration and "getting tough" on China and Russia. She has supported Trump in the past but also criticized him after the Jan. 6, 2021, Capitol attack.
Political party: Republican
Age: 45
Family: Hurd wed Lynlie Wallace, a fellow political operative, in 2022. The two first met in 2009.
Previous political experience: A former CIA officer, Hurd served three terms in Congress representing Texas in the House after first being elected in 2014.
His views: Hurd stands out from an increasingly crowded GOP field as a rare vocal critic of Trump. He joins the likes of Chris Christie and Asa Hutchinson in publicly disavowing the former president and in his campaign launch video listed illegal immigration, inflation, crime, and homelessness as legislative priorities.
Political party: Republican
Age: 72
Family: Hutchinson has been married to wife Susan since 1973. The two share four children and seven grandchildren.
Previous political experience: Hutchinson has had a long career in Republican politics. He was first elected to the U.S. House of Representatives to serve Arkansas' 3rd district in 1997; he served until 2001 when he was appointed DEA administrator and later undersecretary for the Department of Homeland Security for the George W. Bush administration.
While in the House, Hutchinson served as impeachment manager in the trial of former president (and fellow Arkansas native) Bill Clinton. After leaving Washington he was elected 46th Governor of Arkansas. He served for two terms, from 2015 to 2023.
His views: He supports lower taxes, a strong national defense, and opposes abortion. He has said the Biden administration "stood on the sidelines" in the face of crime and “turned its back on the American worker."
Party: Republican
Age: 75
Family: Johnson tied the knot with wife Diane in 2008, and the pair share three sons.
Previous political experience: A businessman trying his hand at politics, Johnson built his wealth with the launch of Perry Johnson Registrars Inc., a company that ensures auto, aerospace and other businesses are complying with industrial standards. In 2022, he threw his hat in the ring for the GOP nomination for Michigan governor before being disqualified because of invalid signatures.
His views: Johnson told a group of Iowa voters in July that he was "pro-life, pro-Second Amendment, anti-woke and anti-China," − and "if you don't like it, well, tough." His campaign's signature "2 cents" proposes cutting 2 cents off every dollar of federal discretionary spending.
Party: Republican
Age: 63
Family: Pence wed wife Karen in 1985 and the two share three children: Michael, Charlotte, and Audrey.
Previous political experience: Pence entered politics in 2000 when he won his local congressional seat. He went on to serve six terms in the House of Representatives before being sworn in as governor of Indiana in 2013.
In 2016, Donald Trump chose Pence as his running mate, and he served one term as Vice President. The role thrust him into a precarious situation in 2021 when Trump sought to pressure him to throw out some of Biden's electoral votes to overturn the election.
Pence ultimately defied Trump and certified the results, infuriating MAGA voters and Trump himself. His candidacy will likely involve a difficult tightrope walk as he attempts to distance himself from the former president without alienating the base.
His views: Pence is a vocal opponent of abortion, and of what he sees as the nation's long-term debt problem. He favors cuts in government spending and lower taxes, and while he often touts his time as vice president and speaks well of the policies that came out of the Trump White House, he has begun to distance himself from his former running mate in terms of tone. He has also criticized Trump's actions during the Jan. 6, 2021 riot at the U.S. Capitol.
Political party: Republican
Age: 37
Family: Ramaswamy married Apoorva Tewari, a throat surgeon and assistant professor at the Ohio State University Wexner Medical Center, in 2015. The pair have two sons together. 
Previous political experience: Ramaswamy is framing himself as an outsider, an entrepreneur-turned-political-hopeful who will give the establishment a run for its money. 
He is a former biotech investor who founded pharmaceutical research company Roivant Sciences in 2014. Ramaswamy left the company in 2020 amid clashes with colleagues over how to respond to the murder of George Floyd and the public outcry that followed. He now heads up Strive Asset Management. 
He is the author of three books, including "Woke Inc.: Inside Corporate America's Social Justice Scam," which explores how American politics and capitalism have become increasingly intertwined. 
His views: He has peddled ideas such as ending affirmative action and eliminating the Department of Education. His elevator pitch: He'll go farther than Trump ever did or could today.
Political party: Republican
Age: 57
Family: Scott is unmarried, with no children. He was raised by a single mother in North Charleston and has one brother.
Previous political experience: Scott first entered politics in 1995 during a special election for City Council in Charleston. His profile grew nationally when he suggested posting the 10 Commandments outside the council building, a proposal that was denied.
Scott served for two years in the state legislature before being elected in 2010 to the House of Representatives for South Carolina's 1st district. He served one term before being appointed to the Senate by then-governor Nikki Haley and becoming the first Black U.S. senator from the state.
Scott is pitching himself as a more hopeful alternative to Trump, drawing on Reagan-era ideals and centering a tone of optimism.
His views: Scott joined the Senate in 2013. He’s anti-abortion and pro-Second Amendment. He says on his website that his “signature legislation,” Opportunity Zones, put $75 billion into “distressed communities” across the country.
Political party: Republican
Age: 76
Family: Trump is the son of real estate magnate Fred Trump. Born and bred in New York, he first made his name developing skyscrapers and casinos.
Trump first married in 1977, wedding Czech-born model Ivana. The two were married for 13 years and share three children: Ivanka, Donald Jr. and Eric. In 1993 Trump married actress and model Marla Maples. The two had one daughter: Tiffany. Following his divorce from Maples, Trump tied the knot for a final time with model Melania, who is mother to his youngest child, Barron.
Trump's family was uncharacteristically involved in his presidency. Ivanka and her husband Jared Kushner played prominent roles in the administration, and both Don Jr. and Eric were often cited as close advisors.
Previous political experience:  When Trump entered the race in 2016, he branded himself as a political outsider, a businessman separate from the establishment, ready to "drain the swamp."
Prior to 2016, he dabbled in politics, often sounding off on controversial issues like the birther movement meant to cast doubt on Barack Obama's citizenship and the guiltiness of the now-exonerated Central Park Five. However, he was still primarily known for real estate and his forays into reality television, famously starring in "The Apprentice."
In 2016, Trump shocked pollsters by securing victory over Hillary Clinton in the presidential race. He served a full four-year term and was defeated by Biden in his reelection bid.
His views: The former president has centered much of his campaign on his purported “political persecution” by Democrats. He supports securing America’s borders, “reclaiming free speech,” and “dismantling the Deep State,” according to his campaign website. He has said he would consider pardoning participants in the Jan. 6, 2021, Capitol riot, which was inspired by his false claims of election fraud.
Party: Democratic
Age: 69
Family: Kennedy bears a powerful last name in Democratic politics. He is the son of Robert F. Kennedy, the former attorney general who was assassinated during a 1968 presidential run, and the nephew of former president John F. Kennedy. Though he originally launched his campaign as a Democrat, Kennedy is now running on an Independent ticket.
Kennedy has been married three times and has six children. He wed current wife Cheryl Hines in 2014. Hines is a television star best known for her role on "Curb Your Enthusiasm."
Previous political experience: Kennedy is an environmental lawyer known for trumpeting a debunked theory that vaccines can be linked to autism.
During the COVID-19 pandemic, Kennedy opposed vaccine mandates, calling them an infringement on individual liberty and at times used the Holocaust as a historical comparison. In 2017, former President Trump invited Kennedy to head up a presidential commission on vaccine safety. 
His views: He is campaigning on a platform of fighting for the "liberties guaranteed by the Constitution," according to his campaign website.
Political Party: Green Party
Though West originally announced his candidacy under the People's Party, he later officially filed as a Green Party candidate.
Age: 70
Family: West has been married five times and has two children. He wed current wife Annahita Mahdavi in 2021.
Previous political experience: Dr. Cornel West is an American academic and philosopher known for his progressive ideals. He has taught at a number of Ivy League institutions and works now as a professor of philosophy at Union Theological Seminary. 
In a video uploaded to Twitter, West announced his 2024 candidacy saying, "I enter in the quest for truth, I enter in the quest for justice." As a third-party candidate, West alleged "neither political party wants to tell the truth" on various issues. His bid with the People's Party represents the first independent ticket to enter the race thus far.
His views: West is a proponent of Medicare for All, and removing oil and gas subsidies as well as drilling on public lands. Long a vocal opponent of militarism, West's campaign website lists "end the wars" as a key priority which would include disbanding NATO and banning nuclear weapons across the globe.
Political party: Republican
Age: 45
Family: Suarez is the son of another prominent Florida politician: Xavier L. Suarez, who was Miami's first Cuban-born mayor. He is married to Gloria Fonts Suarez, and the two share one son and one daughter.
Previous political experience: Suarez serves as the 43rd mayor of Miami, a seat he has occupied since 2017. Prior to that he was Miami City commissioner and served as president of the United States Conference of Mayors from 2022 to 2023.
Views: Suarez has said he did not support Trump in either 2016 or 2020, instead using his ballot to write in the names of Florida Sen. Marco Rubio, and Former Vice President Mike Pence respectively. As mayor, Suarez has championed growing Miami's tech economy, and he has also backed low taxes and increased police spending.
This story will be updated as additional candidates officially enter the race.
WASHINGTON — House Republicans made a major step towards electing a new speaker on Wednesday, formally nominating as a conference House Majority Leader Steve Scalise, R-La.
In an internal secret ballot vote, Scalise beat out his primary rival, chair of the House Judiciary Committee, Rep. Jim Jordan, R-Ohio, by a vote of 113-99, according to Rep. Darrell Issa, R-Calif.
The conference vote however, is just a sign of approval from House Republicans at large. The House still has to formally elect a new speaker on the House floor, and lawmakers are still free to nominate other candidates. 
Scalise’s nomination, however, is a major boost for the Louisiana Republican, who is currently the No. 2 ranking House Republican. 
House Republicans could move to hold a speaker election on the floor as early as Wednesday afternoon.
House Democrats are expected to stay out of the process and rally behind House Minority Leader Hakeem Jeffries, D-N.Y., for the speakership in a show of unity. The onus, they say, is on House Republicans to elect a new speaker. 
SHEFAYIM KIBBUTZ, Israel − They exchanged text messages and emojis. Brief status updates with words of encouragement. A picture of the beloved family dog, Tutsi.
Until no more messages came.
And then, Cindy Flash, an American, and her Israeli husband, Igal, vanished into the violence, presumed kidnapped by Hamas.
Four days after Hamas attacked Israel, more than 100 Israelis and possibly dozens of foreign nationals are thought to be held captive in the Gaza Strip. At least 14 U.S. citizens have been killed and an unknown number are still unaccounted for.
Flash, 67, originally from St. Paul, Minnesota, is one of them. She lives in Kfar Aza, a kibbutz in southern Israel near Gaza, where some of the most harrowing and grisly stories have been emerging over the past few days.
"They are breaking down the safe room door," Flash said in one of her final messages to her daughter Keren, 34. "We need someone to come by the house right now." Keren had been communicating with her parents from a few houses away.
Keren described her mother, an administrator in a local college, as someone who had the "sweetest biggest heart," whom everyone knew and loved, and who had spent a lifetime advocating for the rights of Palestinians, including those who live in Gaza, where she may now be held.
She emigrated to Israel decades ago after a visit during college, when she fell in love with Israel's system of kibbutzim − collectives traditionally centered on agriculture but which have evolved to accommodate myriad interests, tastes and even businesses. 
"They didn't deserve this,'' her daughter said Tuesday on the grounds of a sprawling hotel and resort on a coastal kibbutz northeast of Tel Aviv, where hundreds of people were evacuated after the attack. "No one deserves this."
It was filled with volunteers bringing sandwiches and sweetcakes. Sobbing teenagers, reunited after days of having their worst fears confirmed, hugged one another tightly. Small groups of people sat at tables hunched over laptops compiling lists of the missing. A manager said about 300 people from Kfar Aza were staying at the hotel.
Before the attack, Kfar Aza had a population of about 800. Nobody knows for sure how many survived. 
Cindy and Igal's home in Kfar Aza sits right next to the security fence Hamas militants broke through Saturday morning as they attacked Israel by land, sea and air.
The couple had recently renovated it, which had required that they move away from the kibbutz for a few months.
"They were so happy to be back," Keren said.
And their daughter said that despite their proximity to Gaza, everyone in the family had always felt secure and reveled in their area's lush vegetation, tranquility and sense of community.
In fact, the extended Flash family had expected a very different Saturday from the one they got. 
They had planned a family picnic. And later that afternoon they were going to make and fly kites in the local soccer field as part of an annual community event. Maybe, they thought, they'd have a little ice cream and relax after a hectic week of family life and work. A DJ was going to play.
Instead, Keren, a Pilates instructor, and her husband, Avidor Schwartzman, 37, a media consultant, woke abruptly around 6:30 a.m. to a blaring alarm system and heard what appeared to be the sound of bombs going off. They leaped out of bed and dashed down the hall to grab their 1-year-old baby, Saar, and her bottle, diapers, water and a little food. Then they locked themselves in a room of concrete and reinforced steel.
